{"aliases":{"parameter.shared_weight":"parameter.weight"},"binding":"BOUND","configuration":{"architecture":"ARTIFICIAL_ONLY","context":1,"normalization":{"mean":[0.5,-0.0],"std":[0.25,1.0]},"training":false},"files":{"model.safetensors":{"bytes":1062,"sha256":null}},"input_artifacts":{"artificial_input":{"bytes":7,"sha256":"f16d05ec6b29248d2c61adb1e9263f78e4f7bace1b955014a2d17872cfe4064d"}},"limits":{"dimension":64,"header_bytes":8192,"manifest_bytes":16384,"rank":8,"seconds":5,"tensor_count":32,"total_bytes":65536},"tensors":{"attention.causal_mask":{"dtype":"F32","file":"model.safetensors","nonfinite":"allow_negative_infinity","role":"unregistered_tensor","sha256":"1ca3965a3c8e06306ba5e4c2098239dc5cab8b5e46fb302229a32b5a4d833b2a","shape":[2,2]},"boolean":{"dtype":"BOOL","file":"model.safetensors","nonfinite":"finite","role":"persistent_buffer","sha256":"b413f47d13ee2fe6c845b2ee141af81de858df4ec549a58b7970bb96645bc8d2","shape":[2]},"buffer.nonpersistent":{"dtype":"BF16","file":"model.safetensors","nonfinite":"finite","role":"nonpersistent_buffer","sha256":"7217a7e1150e37f74d5ad8d16e9de9737525110a4f95981262672583a45a872f","shape":[2]},"buffer.persistent":{"dtype":"I32","file":"model.safetensors","nonfinite":"finite","role":"persistent_buffer","sha256":"b5f56b64f014154a5433fcb074019bb39a5bc74b2004cb4670565d57b5af23b6","shape":[2]},"empty":{"dtype":"F32","file":"model.safetensors","nonfinite":"finite","role":"nonpersistent_buffer","sha256":"e3b0c44298fc1c149afbf4c8996fb92427ae41e4649b934ca495991b7852b855","shape":[0,3]},"half":{"dtype":"F16","file":"model.safetensors","nonfinite":"finite","role":"parameter","sha256":"c04a06eb6b0d005d322726a90873ac8edd667bcd00256025fa0201cdf3ba0f1d","shape":[2]},"parameter.weight":{"dtype":"F32","file":"model.safetensors","nonfinite":"finite","role":"parameter","sha256":"0cd40d287b3669a987311a242f957a55c86c626a988a6f0136e0b627684c9fdb","shape":[64,64,64,64,64,64,64,64]},"scalar":{"dtype":"F64","file":"model.safetensors","nonfinite":"finite","role":"parameter","sha256":"6c3c396ed6b5c36dcae172271f462051b1266b851e92df3deea8ac65478fd712","shape":[]},"signed16":{"dtype":"I16","file":"model.safetensors","nonfinite":"finite","role":"parameter","sha256":"ca2fd00fa001190744c15c317643ab092e7048ce086a243e2be9437c898de1bb","shape":[1]},"signed64":{"dtype":"I64","file":"model.safetensors","nonfinite":"finite","role":"parameter","sha256":"12a3ae445661ce5dee78d0650d33362dec29c4f82af05e7e57fb595bbbacf0ca","shape":[1]},"signed8":{"dtype":"I8","file":"model.safetensors","nonfinite":"finite","role":"parameter","sha256":"437cb43a30226e639b33d84533cfc3ddd970a40055b9c8c0bf7e3795cf184eb6","shape":[2]},"unsigned16":{"dtype":"U16","file":"model.safetensors","nonfinite":"finite","role":"parameter","sha256":"ca2fd00fa001190744c15c317643ab092e7048ce086a243e2be9437c898de1bb","shape":[1]},"unsigned32":{"dtype":"U32","file":"model.safetensors","nonfinite":"finite","role":"parameter","sha256":"ad95131bc0b799c0b1af477fb14fcf26a6a9f76079e48bf090acb7e8367bfd0e","shape":[1]},"unsigned64":{"dtype":"U64","file":"model.safetensors","nonfinite":"finite","role":"parameter","sha256":"12a3ae445661ce5dee78d0650d33362dec29c4f82af05e7e57fb595bbbacf0ca","shape":[1]},"unsigned8":{"dtype":"U8","file":"model.safetensors","nonfinite":"finite","role":"parameter","sha256":"06eb7d6a69ee19e5fbdf749018d3d2abfa04bcbd1365db312eb86dc7169389b8","shape":[2]}},"version":1}